1410	徒歩 広い 所在地 駅 交通 邸 地下鉄 神戸 分 物件 阪急 間取り 京都 大阪 資料 詳細 施設 線 誕生 請求 市 さ アクセス 利便 梅田 圏 区 町 向き ロケーション 天王寺 台 阿倍野 御堂筋 価格 見る 無料 住環境 レジデンス 未定 街 納戸 豊中 生活 谷町 充実 公園 草津 阪神 快適 千里 南 駅前 ロジェ 本線 住宅 更 多彩 通 立地 開放 堺 スーパー 緑 中央 揃う 烏丸線 五条 分の 三宮 長岡京 西宮北口 文の里 桃山台 商業 豊か 芦屋 子育て 南森 西宮 都心 病院 ＪＲ 暮らし 性 教育 心斎橋 プロジェクト 始動 点在 小学校 住吉 烏丸 東海道 便利 贈る マンション 大型 市内 長堀 中心 魅力 圏内 神崎川 洛 京阪本線 帝塚山 関目 中之島 淀屋橋 南堀江 鶴見緑地線 住戸 川 直結 検討 地上 ルーム 北千里 御影 最大 千里丘 吹田 設備 感 面積 周辺 建 率 直通 角 ％ 中学校 駐車 身近 王寺 元町通 西田辺 河原町 山本通 今福 急行 リスト 享受 閑静 停車駅 路線 自然 いよいよ 四条 フラット プラン 筋 プランニング 住 タワー 仮称 北大阪 家族 走る 仁川 南千里 今出川 阪南 ハイム 伊丹 歩 鶴見 地 環境 震 ユニ 昭和 石橋 祇園 エリア はじめ 宝塚 住友不動産 場 西 不動産 パーク 可能 快速 全戸 千里線 高台 和泉 住む 近接 フロア 上質 ライフ 淀川 御池 大阪環状線 あべの 少路 塚本 布施 東山 香里園 平面 風情 東三国 高殿 先進 千里山 北大路 都市 モデルルーム 式 フリー 新築 創造 高層 超 西口 ファミリー 北浜 田辺 松屋 京阪 心地よい 免 潤い なんば 階 予定 トランク 登場 東灘 住まい 空間 あふれる 停車 住居 丘 ハウス 確認 可 広がる 敷地 穏やか 良好 邸宅 府 三明 八坂 森ノ宮 市立 朝潮橋 西神中央 麩 守口 暮らせる 光明池 御影中 西洞院 阪和 嵐山 南船場 大石 嵯峨 法円坂 池田 京橋 集積 分譲 機能 バリエーション 院 沿い 林田 規模 入れる シティ れる 確保 日常 中京 通勤 兵庫 賃貸 ライフスタイル 歴史 関西 保存 神 道 オープン 屋 大人 デビュー 春日野道 三ノ宮 市外 制 優れる 景観 私邸 買える 低層 地区 丁目 級 開始 奥まる ランド 恵まれる 機関 リバー 一戸建て 近い 期 モール 収納 文化 文教 中古 学校 含む 型 中津 長堀橋 泉北 伏見桃山 夙川 大阪城公園 住之江 谷町線 藤白台 御門 庄内 今津線 星陵台 下京 堂島 サンマ 岡崎 油小路 神南 安堂寺 郷 中崎 下鴨 左京 エルグ 四つ橋線 美しい 仕様 額 ノース 長尾 楽園 玉造 苦 実現 付 初 発表 暮らす 枚方 ガーデン ショッピング テラス 北 天神 応える 元町 後 タイプ 普段 開発 ビッグ 独立 通る 落ち着く 高める 鉄道 高速 古江台 城東 千里中央 積水ハウス 成熟 角地 眺望 隣接 共用 特急 近鉄 デッキ 南東 抱く 愉しい 公開 前 面接 建て 王子 目 的 育む 採用 浜町 寄り添う 高い ワイド さくら 完備 嬉しい 豊富 主要 溢れる 戸 ホームズ 使い方 リフォーム イオン セレクト スムーズ 奈良 専用 これから 県 レポート 始まる イン 整備 複合 包む まとめる 気 安心 大路 レース 構造 東 毎日 専有 等 新しい 山手 エコ 楽しめる 堀江 ビスタ 美章園 レフ 上町 寺田 東梅田 賑わい 淡路 通風 アリーナ 西長堀 幹線 桃谷 四天王寺 鶴見緑地 メトロポリス 公園通り 住ノ江 門戸 永住 爽快 上京 東心斎橋 打出 魚崎 県庁 藤森 受電 方角 迎賓 東川崎 三方 夕陽丘 路 西大路 三津屋北 芦屋川 神祇官 ジーク 南海本線 灘 堂ヶ芝 佇まい 市役所前 万代 あかり 北摂 丸太 一望 採光 厄神 苦楽園口 見据える 北野 阪急不動産 甲陽線 樋之池 新開地 六甲山 ファミリア 各駅 阿波座 真田山 伏見 垂水 内 東西線 代 清流 折々 買物 華やかさ もたらす パレス 広場 計画 洗練 電鉄 うれしい 受付 次世代 クラス 高圧 絵 高野 南海 居住 地域 薫る みち 漂う セキュリティ システム 振る ゴミ 設計 老舗 おもてなし 立花 使い 特徴 様々 今福東 福島 関西本線 ファースト 華やか 接 台地 始発駅 寛ぐ 見積もり 四方 庭 東急不動産 堂々 ぶり 南側 風致 装備 ポジション 廊下 大通り みんな コミュニティ グランド 三菱地所 待望 導入 叶う 通学 京 現地 位置 商店 引越し 戸数 さらに 通り 並み 百貨店 満喫 並ぶ 幼稚園 両立 古い 用意 感じる 条 理由 本町 見せる 売却 粋 滋賀 舞台 ゆとり 完売 モダン アドレス 橋 叶える 彩る 欠く 医 土地 進化 一括 追求 査定 全国 ライオンズ 四季 翠 光 今後 ローン 満たす 層 演出 電気 ワン マルチ 公共 おしゃれ サポート センター 作 場所 あり 金融 医療 入居 づくり 少し 平均 種 徹底 心 事業 食 ならでは 特別 相談 対応 杜 見つかる 安全 守る エル 花 買う ショップ 評価 人 道路 せる 申込 間 いっぱい たっぷり 選ぶ マイ 販売 レ デザイン もちろん 入る 電柱 真正面 風格 南禅寺 うめく 最寄り 鹿ノ下通 学研都市線 新北野 布引 張 西渋川 鴨谷台 福知山 神足 済生会 深呼吸 モダニズム レジャースポット 響く 境地 悠久 一直線 帝塚山西 五山 安らぐ 安らぎ 下鴨東森ケ前 住之江公園 翠ケ丘 隣地 陵 長野東 平安 住吉公園 山陽電気鉄道 久度 住吉東 モノレール 河川 御所 大阪ドーム 深江南 深草キトロ 融和 北新地 南長尾 遮る 奉行前 宮 ニシ 三反田 悲田院 明石海峡大橋 苦楽 桂川 浜辺通 登記 竹見台 いずみ 蒲生 新神戸 中核 のびやか 松ケ崎 千里丘下 実物 冷泉 複 唐橋 雅 粋人 崎 都賀 市役所 北葛城 シミュレーター 千里山星が丘 山系 エコール 堀之上 縦横無尽 大林 阪神国道 天神橋 きわだつ 夷川 妥協 藤阪東 西梅田 ミナミ 上る 紡ぐ 連ねる 保温 キタ 古都 堀川 夕陽 寝屋川 情緒 寛げる 片町線 ノンストップ 高め 六甲道 結実 嵯峨新宮 寺戸 設える 息づく 進取 住友商事 東面 玉造本 夕陽ケ丘 ジェイアール西日本 斜面 栄町通 遺産 尼崎 鴨川 別荘 上立売 浜口西 内覧 趣き 小児科 星和 京阪百貨店 くらせる 手中 川原 サッシ 紫野雲林院 西向き のぞみ野 名鉄 阪 臨む 池島 魚崎南 坪 山側 唐橋川久保 北側 下鴨神社 西入 闊達 岡崎南御所 山鉾巡行 南端 糺 神楽 百足屋 北面 ぎんなん ドラム 信号 壮大 出口 堂ケ芝 思想 もたせる 併せ持つ 山陽本線 日当 美学 向日 下る 間口 庄内東 浴槽 直接アクセス 謳う 脇浜 江之子島 メゾネット 京阪本通 壬生坊城 界隈 天使突抜 稜線 ディスポーザー 送り火 竹の台 難波 軒 ルーフ 南大阪線 愛する 語り継ぐ もてなす 万歳 掌中 携える 山陰本線 ブリッジ 祇園祭 寿 なだらか ダイワハウス 平屋 南田辺 開口 千日前線 東中 由緒 古墳 津雲台 右京 足代北 蛭子 玉井 井吹台西 新幹線 新千里南 中白山 西天満 手 スマート マーク 海 感性 やすらぐ 麗しい 乗り継ぎ 喧騒 東大阪 発想 辻 謳歌 伸びやか 和洋 築く 斜め やく パーティ 多面 降り注ぐ 東住吉 神宮前 美意識 出逢う ミセス 心から 居 防犯 寄る 訪れる 成約 感度 公園前 ギュッ ほど近い ストリート 芯 マルイ 奏でる トランス 遅い 相応しい 有する リビング 側 清々しい 注ぐ ふれあう 総力 出し 強力 ロード 池 自由自在 志向 極める グッド 唯一 こなす 存分 壁 五感 大阪ガス 優雅 コンパクト 待つ 外食 都会 精神 交流 供給 行ける 宅地 図書館 群 空港 ロボット 彩 兼ね備える 流れる 棟 良い コーナー 適す 郡 港 余裕 史上 気持ちいい 風光 匠 スペース 主義 明媚 大宮 買い物 完結 ポート 旅館 シャープ サイクル いっしょ 忠 ランク 映える 家具 同士 渡る ルート 堪能 彩り 形成 チェック トップ つなぐ 旭 構築 六甲 飲食 爽やか 原点 新千里東 北口 満ちる 溶け込む 個性 魚 空気 即日 軽減 集合 華やぐ 甲 含める 震る 使いこなす 意匠 改札 住まう 落ち着き 陽光 エン 静けさ 大空 区画 我が家 纏う 若干 作り 建てる 市営 伊藤 三井不動産 そば 南面 始発 生かす バルコニー 自転車 創出 水辺 交差 南西 憩い スパン 前列 年収 面する ターミナル 見晴らす 防災 面す 結集 最前 誇り ガラス 時間 ため 使いこなせる 方面 集う オアシス スケール 広々 高齢 一体 電化 いま 受け継ぐ 湊 ブリ くつろぐ 店 世代 リア 外観 距離 著しい 注目 スピーディ アパート 開業 奥 家電 注文 口 先着 明治 馬場 支える 乗り換え 両方 方式 体制 お洒落 標準 野村 組 カフェ 優しい 将来 シーン 削減 講座 ふさわしい 風景 フラワー 生きる 展望 タウン 山田 搭載 クリニック 手がける 設置 席 拠点 生まれ変わる 活かす 配慮 借りる アプローチ 倉庫 進行 ダイレクト 優良 もと 発展 伝統 存在 フロント プライベート 記念 愛 雰囲気 最も 歩く 呼ぶ 長期 体感 カンパニー 整理 由来 共同 大 建築 どこ 重視 リンク 少ない 甲信越 社 忘れる 深い め 白 認定 建物 インタビュー すべて 使う 順 特集 時 不要 一部 おる 戻る リクルート 働く 連続 自由 日々 売る 四国 北陸 置く 役立つ 夜 わかる メイン 取得 幅広い 長い 心地 月額 東海 コンビニ 価値 突破 ライブラリー 記載 それぞれ 印象 集まる 進む さまざま 完成 流れ マガジン 九州 聞く はじまる 東北 独自 決定 贅沢 多数 変わる サイド 園 沖縄 予め ここ シリーズ ご覧 明るい 加える 作る ヶ月 行く 中国 北海道 コーディネート 和 料金 基本 更新 こだわる 上 部 高津 者 実際 土 その他 メール 品質 グループ 向け 開催 ガイド 楽しい 風 合う そう 以上 探す プライバシー 方 ない 年 閉じる 世界 実感 料 了承 常盤 ステージ 店舗 先頭 目指す ヒル 最新 ら 現在 くれる 月々 返済 多く 総合 水 以内 希望 地下 カラー こだわり 番 森 会 部屋 品 みる プレミアム 新着 いただける メニュー 自分 営業 最終 関東 初めて もの プロ 使用 あなた 今 美容 届け やすい 合わせる ブランド よう うち スタイル の られる 予約 購入 女性 お知らせ すぐ マップ 期間 ポリシー 商 こと サービス 会員 規約 くださる 利用 ページ 情報 登録 いる 円 会社 月 サイト なる 中 する ある 問い合わせ できる 日
804	肌 潤 水分 回分 毛穴 潤い 取りこむ エッセンス 創る 化粧 トライアル 改善 非売品 内部 水 ライス 石鹸 マスク 空気 自ら だす 取り戻す パワー 悩み クリーム 能 湿る 保 セット ステップ 内容 保持 しぼむ 膜 張る 米 浸透 重ねる エキス ベタベタ 炊きたて でこぼこ ばっちい 乾燥 日間 ども 永い コーセー 一同 加速 生す 多様 事実 ８月 世界一 抱えこむ 因子 子会社 年齢 配合 こむ 乳酸 差 成分 細やか 参る 失う もう一度 黒ずみ 代 通販 思い 長年 紫外線 働きかける ほとんど 展開 望む 努める ダメージ 熱い どんどん 渡る 補う 菌 満ちる ふっくら 維持 キメる 大豆 こちら 購入 開く みたい 保護 効果 株式会社 刺激 産 処方 不足 解決 発酵 天然 角質 調べ 全体 層 安心 包む よう 自信 原因 ハリ 研究 キープ 実現 てる 重要 言う せる 量 の キレイ れる 付き こと 専門 化 しっかり 実感 美しい くれる 続ける 現在 持つ いく 開発 力 私 税込 表記 日本 さらに 届け お客様 サポート アイテム 年 ない 気 個人 使う 基づく 送料 女性 られる 概要 プレゼント 法 限定 プライバシー 分 商品 ポリシー 商 取引 特定 無料 いる 円 会社 月 なる 中 する ある できる 日
1413	期 面積 専有 間取り 徒歩 対象 プレゼント 台 線 販売 区 分 市 ＪＲ パーク 東京 都 県 見学 横浜 可 神奈川 ハウス 未定 レジデンス 川崎 町 予約 千葉 高崎 デュオ 中央 納戸 マンション ヒルズ 新築 戸塚 次 桜新 シティ ガーデン 浦和 埼玉 山手 メトロ 本線 住戸 横須賀 三田 加賀 板橋 号室 テラス 先着 杜 エリア 順 以下 ルーム プロジェクト トランク 汐見台 緑が丘 八千代 津田沼 モデルルーム ホームズ 品川 奏 都営 新横浜 草加 鎌倉 前橋 蓮根 朝霞 京王 西葛西 多摩 北 らい 世田谷 タワー 濱 バス 東 京 月々 返済 恵比寿 新三郷 八王子 ステージ 横 流山 越谷 ヒル 駒込 追浜 ニュータウン 含む 戸 京浜東北 コート 森 渋谷 新子安 西新宿 神明 淵野辺 武蔵新城 鷲宮 小平 松戸 小川 石神井台 群馬 南 ブリ リア 街 相模原 成城 馬車 府中 勝島 北浦和 西武 上大岡 学芸 東大島 上鷺宮 大山 沼 小田急 有明 常盤 東急 つくば 大崎 ライオンズ 埼京線 田園都市線 喜多見 景 後楽園 大師河原 鶴間 小石川 港 番 東海道 大学 道 棟 磯子 仮称 新宿 上本郷 小規模 林間 ナス アル ブライト 川浜 若宮 六義園 別所 検見 ペット 区別 予定 南北 多摩川 地震 習志野 センター 武蔵野線 東町 坂 トップ 大和 港北 千代田 大師 さいたま 大路 太陽光 志村 うち パレ 伊達 パークマンション 綱 東西線 行徳 桜ヶ丘 ら 上野台 江東 坂上 学園 新川崎 オーク 芝浦 ふじみ野 未満 角 四季 エクスプレス 戸田公園 ウエスト 彩 茨城 晴海 設計 入居 部屋 豊島 東武 対策 リスト 武蔵 所 通り 池袋 最終 プレミアム 聖蹟 北松戸 南花島 羽 浮間 小田栄 九蔵 由比ガ浜 物件 プロ 価格 まとめる 中浦 スタイル 真砂 四谷 桜田 検見川 駒沢 陽光台 久喜 東習志野 泉水 東砂 東大和 舞岡 拝島線 実籾 浜 上矢部 電鉄 下平間 中央林間 江戸川 つきみ野 大滝 押上 成城学園 関 野沢 半蔵門線 子安 北品川 かう 赤 下鶴間 南武線 板橋区役所前 アトリエ 稲城 りん 根岸旭台 岩戸北 江ノ島線 シーサイド 港町 代々木上原 三郷 狛江 宇都宮線 落合 イースト 戸神 妙典 総武線 お花茶屋 上麻生 矢部 東綾瀬 小仲台 サー 付属 元浜 和 春日部 毛 墨田 加藤新田 立花 ハナ 市川 根岸 等々力 平 おう 新白岡 領家 市が尾 常磐 みなとみらい 美浜 志木 高津 道路 変更 たま 麻布 追浜東 産業 前 東急東横 練馬 すぐ 京成 芝 レ エア 条 ラ インペリアル 高速 富士見台 印西 渡 キャンパス 上石神井 葉 快速 玉川 ロイヤル 祐天寺 伊勢崎線 南流山 ミソ 中野 柏の葉 田町 稲毛 川口 鉄道 幸 総 南山 探す 京葉 本町 日本橋堀留 新地 東上 文京 ゲート 当該 幕張 小豆沢 期日 翠 ときわ台 パス 栃木 茅ヶ崎 二子 勝どき シーズン 大江戸 公園 ビッグ 目安 地下 テーマ 近隣 南池袋 丸ノ内線 都心 都市 帯 ワンダフル 子 大宮 室 新作 西 駅 号 階 他 今 不動産 資料 一部 リクルート 時 向け グループ 部 上 請求 マップ その他 以上 ポリシー 期間 掲載 サービス チェック 特定 年 紹介 規約 使用 プライバシー 利用 ページ 情報 円 会社 サイト 月 中 する ある 問い合わせ できる 日
1318	期 面積 専有 間取り 徒歩 プレゼント 対象 台 区 線 ＪＲ 販売 分 市 パーク 県 東京 都 川崎 神奈川 横浜 未定 見学 ハウス 可 レジデンス 千葉 町 マンション 予約 浦和 納戸 新築 先着 埼玉 中央 ガーデン 順 シティ 戸塚 次 デュオ 北浦和 京浜東北 住戸 板橋 ヒルズ 高崎 山手 磯子 プロジェクト 東急 三田 ニュータウン 加賀 桜新 号室 テラス 杜 ルーム エリア モデルルーム メトロ 本線 世田谷 さいたま 田園都市線 北 以下 バス トランク 等々力 八千代 緑が丘 汐見台 奏 津田沼 ホームズ 草加 志木 多摩 川口 稲毛 西葛西 蓮根 濱 東 リア 街 ブリ ヒル 返済 月々 二子 ライオンズ 横 茅ヶ崎 新三郷 新川崎 恵比寿 八王子 小田急 含む 戸 渋谷 都営 東海道 番 西新宿 武蔵 コート 晴海 タワー 鷲宮 小仲台 市が尾 領家 上麻生 武蔵新城 淵野辺 石神井台 神明 松戸 たま 南 上大岡 本町 学芸 新地 幸 大山 上鷺宮 玉川 成城 キャンパス 柏の葉 大崎 ときわ台 常盤 大師河原 鶴間 小石川 戸田公園 喜多見 ステージ 埼京線 後楽園 景 まとめる 棟 大宮 子 東武 横須賀 大学 北山田 最終 新宿 仮称 京 青葉 南武線 六義園 ナス 小規模 上本郷 アル 高津 ペット センター 物件 トップ うち 予定 西武 坂 港北 パークマンション 伊達 総 パレ 相模原 大師 太陽光 印西 京王 志村 ロイヤル 南流山 地震 綱 習志野 南北 ゲート オーク ふじみ野 角 追浜 東上 駒込 戸田 ら 上野台 四季 未満 シーズン 坂上 学園 ウエスト 森 入居 品川 ワンダフル ビッグ 彩 港 公園 部屋 対策 価格 通り 池袋 プレミアム 関東 北松戸 南花島 小田栄 市ケ尾 資料 東大成 桜田 久喜 舞岡 東習志野 実籾 矢向 小倉 都筑 北加瀬 大井 新石川 豊洲 江戸川 上矢部 金山 瀬田 若柴 下平間 南町 沼影 成城学園 関 押上 半蔵門線 野沢 根岸旭台 岩戸北 江ノ島線 総武 落合 子安 浜見平 武西学園台 戸神 イースト 麻生 代々木上原 港町 北品川 宇都宮線 前野 アトリエ 下鶴間 柿生 板橋区役所前 三郷 狛江 検見 別所 お花茶屋 東綾瀬 ハナ 林間 小川 ブライト 矢部 立花 若宮 春日部 総武線 小平 川浜 墨田 新白岡 根岸 付属 サー 群馬 請求 版 常磐 京成 区別 道路 コミュニティ 産業 麻布 新横浜 前橋 東急東横 すぐ 練馬 前 鎌倉 探す 祐天寺 高田馬場 大久保 伊勢崎線 芝 多摩川 レ エア 鉄道 南山 快速 千代田 東大島 大路 ミソ 中野 らい 武蔵野線 葉 日本橋堀留 東町 朝霞 渡 上石神井 馬車 大和 富士見台 府中 勝島 条 ラ 高速 インペリアル つくば 幕張 当該 期日 小豆沢 栃木 行徳 パス 有明 勝どき 柏 芝浦 翠 越谷 流山 大江戸 グリーン 東西線 桜ヶ丘 文京 江東 エクスプレス リスト 都心 ライン 南池袋 テーマ 道 都市 帯 茨城 丸ノ内線 目安 地下 豊島 近隣 新子安 所 号 新作 室 西 駅 チェック 不動産 特集 リクルート 使用 一部 おすすめ プロ 今 他 スタイル 階 マップ 向け グループ 部 受付 その他 プライバシー 掲載 年 特定 紹介 以上 ポリシー 期間 規約 サービス 利用 ページ 情報 円 サイト 会社 月 中 する ある 問い合わせ できる 日
940	モニター やせる 写真 コース 身体 効果 減量 数値 脂肪 いただく せる 募集 引き締め 広告 お腹 お客様 痩身 合意 もれなく 選定 パリ 体験 痩せる いたす ステップ セル フルコース 温める 来店 抜き ミス あわせる 汗 バーン 更に トリプル 遠い 筋肉 最適 カウンセリング 方 社内 通う 全身 ライト ダイエット サロン 赤外線 提案 いく 疲れる ツボ 決定 特典 こちら 分 使用 申し込み 追加 健康 運動 初回 料金 ボディ プレゼント サウナ 代謝 勧誘 宣言 エステ 部分 プラン 特許 なめらか 夏 税 落ちる 資格 安心 返金 出す 同時に ずっと 専門 なかなか 丁寧 浴 新陳代謝 活発 毒素 あて 美しい 代 目指す 内 担当 機器 やすい オリジナル 内容 資料 詳細 無理 確認 よう 的 者 場合 対象 ドレッサー 有害 消毒 居心地 ふれる ７つ ターゲット 全て 近く つける パック 刺青 ペイント 上り ライトバーン 循環 踊り 下り 既往症 皮下脂肪 習う 階段 皆 深部 設ける もみ フラメンコ ミクロ 服薬 説明 技術 初めて 大量 シール 実証 秒間 血液 迅速 波 プロポーション パット 蓄積 凹凸 崩す ドライヤー すっかり 吸引 見違える スタッフ 嬉しい よい 発汗 掲げる 燃焼 固い 体力 談 かく 出せる 法 上 排出 分解 店内 検証 ほぐす 通える 夕方 国内外 内臓 あまり 何より 差 時 用意 歳 気 習得 引き締める 引き締まる 太もも 働き お待ち お出かけ 胸 太る お断り 頑固 帰り 体内 アート ケア 減る 清潔 体重 芯 併せる 活性 衛生 酵素 窓口 通院 組み合わせる 指導 効率 感動 ライン 行う 箇所 世紀 補助 やわらかい シャープ 悪い 導く 軽い 保つ 集中 周り なれる 科学 スッキリ さん 本気 成功 習慣 申 すっきり 品 エネルギー 毎回 いただける 食事 刺激 迎える 以前 立地 完備 すごい ふさわしい 見た目 皆様 こんなに 元気 基礎 ヘア 体調 スムーズ 応募 入会 整える 共同 込み 改善 おる こと 有効 変化 にくい 出来る もの くださる 落ち着く 取得 徹底 試す 外 教育 うれしい 機関 原因 かける イメージ 受ける 独自 変わる 研究 充実 頂く 赤 期限 事項 システム 状態 楽しむ それ 満足 契約 ショップ 限り の 専用 これから 消費 言う れる 以上 化粧 もちろん 化 しっかり つく 食品 理由 店舗 仕事 持つ 医療 肌 注意 大学 力 管理 思う 良い 希望 等 対応 駅 条件 始める 号 高い くる ％ ショッピング もっと 特別 個人 センター あなた プロ 回 予約 後 限定 人 概要 商品 ポリシー 見る 価格 プライバシー 今 探す 利用 いる 円 会社 月 なる 中 する ある 問い合わせ
332	件 甚平 パーティー すばやい 事前 確かめる いれる 急ぎ カラフル 当店 在庫 確定 まだ 残り 勧める 税込 進める 注文 確保 わずか スムーズ 出来る 詳細 手続き 進む 頂く 状態 会員 場合 下さる デザイン スーツ 商品 注意 全て カート 浴衣 アイテム くださる オール ペーパー ロンパース 雑貨 おもちゃ ベビー 間違い 目立つ 服飾 靴 人気 ため 発売 季節 指定 祝い カバー スパッツ キャミソール 丈 出産 ログイン 見る 順 サイズ ベスト どうぞ レギンス シューズ ブランド れる 方 タンク 帽子 ブーツ 柄 最後 その他 Tシャツ キーワード スカート 長袖 エプロン セパレート ボレロ 胴着 おくるみ アンド タイツ 絞り込み マント 限定 パジャマ セーター サスペンダー 肌着 トレーナー 下着 パンツ ソックス 福袋 際 ビーチ ブルゾン 半袖 類 パーカー ベルト ジャケット 検索 ブラウス 新作 注目 あと ニット ギフト アクセサリー カーディガン 水着 シャツ おしゃれ ネット セキュリティ 平日 買う 次 別 分 価格 ワンピース バッグ 店舗 カテゴリ コート ホーム 買い物 新着 お気に入り 探す 合わせる トップ 案内 法 一覧 基づく 概要 ガイド おすすめ ポリシー 規約 商 取引 特定 プライバシー 表示 利用 情報 登録 会社 サイト する ある 問い合わせ 日
946	許可 展望 夢 羽織り 正会員 プリモ クス プリズム 羅 モンスター ピッ 高度 チョコレート 用語 ストーン 解除 デイリー 集 業 動画 機器 問 シューズ コーディネート 系 プラン 番号 医療 管理 等 新作 号 表記 合わせる ガイド 法 基づく 検索 トップ プライバシー 販売 規約 商 取引 特定 ポリシー 商品 利用 情報 登録 会社 サイト
