117	駅 邸 詳しい 台 線 誕生 東京 徒歩 直通 区 分 向き 都 レジデンス 予定 見る 未定 規模 街 緑 住宅 最寄駅 ＪＲ 路線 市 中心 分の 圏 低層 アクセス 豊か 開発 敷地 横浜 所在地 震 山手 新宿 県 京王 メトロ 都心 船橋 パーク 建 プロジェクト 邸宅 施設 公園 南 千葉 中央 利便 物件 資料 開放 免 町 全戸 神奈川 間取り 大手町 丘 南東 大型 階 ゆとり 小田急 町田 請求 秋葉原 タワー マンション 戸 住環境 高台 南西 商業 三菱地所 広大 内 世田谷 多摩 駅前 丁目 有楽町 フラット 超 立地 ハウス 地 渋谷 閑静 始動 エリア 詳細 建て 銀座 ％ 複合 多彩 都営 調布 平塚 庭園 面積 杜 アプローチ 静か 代々木 住居 地区 堂々 川崎 森 発電 空間 地上 戸数 池袋 高層 れる 日本橋 東急東横 子育て 住友不動産 駐車 最大 住戸 モデルルーム ニュータウン プラン 浦和 贈る 中野 和光 南柏 鷺沼 井の頭線 桜上水 豊四季 狭山 高根台 辰巳 停車駅 享受 共用 ロケーション 抱く 快適 スーパー 地域 住まい 早稲田 武蔵 東武 大学 国立 杉並 直結 穏やか 美しい 価格 広がる 埼玉 神楽坂 場 制 戸塚 学芸 魅力 事業 ホームズ 性 吉祥寺 丸ノ内線 仮称 流山 東西線 茅ヶ崎 柏 環境 登場 文京 学園 蕨 見晴らす 可能 可 包む 武蔵野 新小岩 区内 用賀 東十条 田端 永山 野村不動産 富士見ヶ丘 浜田山 小竹向原 白金 武蔵境 便利 港 都市 本線 潤い テラス 寄り添う 種 分譲 住 勝どき 生活 身近 ラウンジ 暮らし 自然 専用 無料 シティ 新築 周辺 スカイ 通勤 フロント 鶴見 賃貸 新しい 揃う 充実 総武 目黒 家族 京浜東北 あふれる センター 建物 根岸 三田 つくば 板橋 角 八王子 場所 四谷 率 浅草橋 近接 スパン 始発駅 廊下 三井不動産 道路 いよいよ スケール 恵まれる 浜町 ワイド 完成 帯 品川 道 一戸建て 相模原 的 北浦和 西葛西 西武 千代田 太陽光 足立 中古 文教 蔵前 見渡す 西新井 北町 全量 八丁堀 永福 京王堀之内 代々木公園 湾岸 木場 弘明寺 金町 清水建設 保谷 茅場 千歳台 高田 一角 中枢 参宮 守る アドレス 彩る ダイレクト 内側 急行 江戸川橋 歩 加賀 大江戸 東急 恵比寿 埼京線 囲む 売 暮らす 電気 オープン リア 通り 感 小 野 開始 構造 奏 磯子 津田沼 東海道 電 成城 玉川 快速 稲毛 田町 小杉 弾 大通り 圏内 結集 和泉 水辺 ロジェ 景観 公開 モール 一体 芝浦 田園都市線 エクスプレス 小石川 ヒル 不動産 ブリ 育む ランド ガーデン ショッピング 研究 スタート リバー 並み 削減 主要 小学校 橋 発展 晴海 以内 土地 イオン 進化 館 リフォーム 常磐 受付 みなとみらい 整備 マルチ 初 社 ライフ さいたま ルーム 蓮根 大山 坂 公共 南北 デザイン 渡 北 有 大師線 紅葉 直線 英知 おおい 弥生 眼前 仙川 海浜 森林公園 児童 運行 寄 南越谷 ゲストルーム 原町田 東横線 谷 方南町 千歳 大蔵 クレア 堀之内 シャトル バス停 新越谷 諏訪 竣工 南雪谷 富士見 江北 信濃 跡地 千住大橋 神宮 緑化 菊名 中野富士見町 京浜東北線 祖師 西早稲田 擁する 袖ヶ浜 セントラル メイツ 得る 東 注目 西 京 プレミアム 級 東海 海岸 相互 桜木 かつて 建つ 川越 並木 軽快 新井 傍ら 幕張 新三郷 喜多見 鶴間 四季 駒込 東上 江東 コラボレーション 電車 備える 三鷹 村 ツイン 画 手掛ける らくらく 外苑 配す 計画 進む 洗練 設備 前 さ 樹 ハイ 白金台 広尾 五本木 公益 中華 型 関西 明るい 加える 西新宿 新橋 パーティー コート ビッグ 望む ライン 調和 おう デビュー 付 新た 施工 浅草線 台東 アトラス 使いこなす 纏う 点在 市営 デッキ 住まう 住む 見積もり 始発 特急 眺望 面す 成熟 タイプ これから 湊 グランド 受け継ぐ 電化 オアシス 広々 叶う 創造 良好 納戸 関東 バス 引越し 開業 等 明治 描く 現地 位置 近い 西口 上鷺宮 付き 用意 南山 馬車 上石神井 富士見台 大和 トップ 港北 祐天寺 総 印西 濱 感じる タウン 運転 休日 売却 カフェ 収納 バリエーション ふさわしい 生まれ変わる 舞台 溢れる 席 進行 優良 長期 医 査定 地下鉄 スムーズ 常盤 続ける 手 オーク 景 ら 横 機能 ときわ台 有明 二子 大崎 戸田 始まる 光 発表 認定 上質 やすい 最後 期 気 水 横須賀 設計 茨城 落ち着く 葛飾 月額 茗荷谷 づくり 九州 東北 野沢 園 ブルー 成城学園 採用 高い 店 くる 日本 さらに 相談 中国 石 稲城 システム 北海道 実現 墨田 妙典 総武線 料金 はじめ 豊富 買う 実際 産業 そう 上福岡 元町 練馬 現状 すべて まとめる 専門 うち 大師 姿 パークマンション 水道 車寄せ 東武鉄道 市中 雪が谷大塚 イトーヨーカドー 相鉄 日暮里 常磐線 千駄木 傾斜 及ぶ 京王線 ファイター 公邸 空地 白幡 最上階 床 羨望 興和不動産 水路 そびえる 蒔田 東神田 亀戸線 動 北新宿 王国 街路 並木道 鈴木町 有人 市街地 新設 千歳船橋 日大 真価 代田橋 中庭 玉川上水 西新井本 ロマン ららぽーと 静謐 集約 倣う 西側 民 日吉 桜木町 憲章 大正 中里 称す とつ 東京建物 知事 新富町 さく 保育園 中規模 小・中学校 自在 元宮 活気 壁面 新吉田 舎人 ノスタルジア 乗入れる 新日鉄 代々木八幡 湛える 下新倉 久我山 日立 さきがけ 恩賜 散策 叡智 月島 千住橋戸 緑園 プラチナ クラッシック 小田原 南北線 隅田川 袖ケ浜 街並み 島田 泉岳寺 交差点 牛込 浄 施行 景色 階数 洋館 官民 遂げる レンガ 静寂 戸山 真ん中 都立 今秋 丸紅 河川敷 革新 西友 緑地 うってつけ 村井 駅北 新居 デンマーク 海辺 中央南 東側 鹿 市初 西東京 高島平 入間 坪井 馬喰 池上線 懐 入間川 導き出す 八幡宮 特等 環状 区域 伊勢崎 牟礼 目黒本 鶴牧 崖 羽田 岩本 参宮橋 深緑 宮前 有楽町線 護国寺 大師駅前 象徴 小田急不動産 境南 温か 石神井川 木々 運河 共に 高根 壇上 谷根 共鳴 望める 矢来 中腹 大岡 小竹 新富 東新小岩 横浜プリンスホテル 継ぐ 南元 高島屋 ライナー 奥行 松涛 日新 稲毛東 大林組 大成建設 系譜 紅葉ケ丘 国分寺 号線 馬引沢 県内 三菱商事 入口 馬喰横山 岩崎 浜離宮 付近 文士 新京成線 野田線 やまと 千住 地元 都内 ｍ ダイナミック 校 日照 刻む 環 羽田空港 まち 植 勧め 究極 小山 浅草 公団 亀有 校舎 成田 民間 揃える 容易 絶景 和田 志 公 選 佇む 神谷 大樹 中旬 頭金 かたち 家中 過ごせる 格 降りる 江戸 育 およぶ 東陽 特筆 隠れ家 近所 湘南 チカ 光熱 情景 名所 コト 畳 一環 歳月 ヨーロッパ 屋上 大師河原 美 追浜 マーク 新川崎 翠 全国 越谷 ステージ 戸田公園 期日 海 当該 ゲート 行徳 目 坂上 後楽園 ふじみ野 代 拍子 荒川 暖房 有数 施す およそ 手法 飯田橋 荘 すく 開通 メグ 眺める 屋外 跡 沿線 監修 機構 加算 のんびり 最多 ハイブリッド 調 織り成す ２つ 追い求める メガ ボーナス まく 新川 配置 のびる 麻布十番 抜ける 行 新都 東口 付き合い 堀 来場 花火 のびのび 似合う 大会 程よい ベイ 放つ 皆さま 高 社宅 段階 まっすぐ 電力 部屋 会 汐留 素晴らしい 親しむ 大宮 車 築地 バー 美術館 連携 まさに ワンダフル 山 一貫 残る そろう 再生 グレード 融合 世紀 流 数々 沿う 以上 年 癒す 最大限 受け取る 領域 優先 活 味方 深夜 判断 柳橋 既存 数字 発見 大田 豊 行政 なか 中丸子 創出 建てる 番地 接 南面 中原 バルコニー 自転車 大空 静けさ 東急不動産 面する 愉しい ターミナル 憩い 前列 意匠 改札 私邸 落ち着き 陽光 風致 防災 積水ハウス 角地 最前 南側 誇り 市部 庭 停車 台地 四方 寛ぐ すでに 我が家 区画 装備 ポジション 交差 フロア 隣接 震る 購入 られる 人気 時間 予約 上 高齢 レストラン 自慢 集う 王子 ちる そこ 方面 使いこなせる 通学 奥まる アパート 商店 モノ くつろぐ 著しい 毎日 世代 進める 集める 注文 圧倒的 さくら やっぱり スピーディ 馬場 まるで 距離 外観 保育 乗り換え 標準 ファミリー ついに 両方 迎える 並ぶ 満喫 超える 広い 両立 幼稚園 お洒落 風景 粋 搭載 心地よい 言葉 代表 講座 完備 運動 費 野村 取り入れる 日常 鈴木 植物 手がける 設置 厳しい 確保 拠点 時代 完売 倉庫 叶える 存在 伝統 モダン 配慮 借りる ビジネス 学 誇る 子供 カンパニー 国内 プライベート 一括 歩く 参加 体感 やさしい 整理 生まれる 歴史 レポート 残す ライフスタイル 是非 仕様 大 建築 ローン 業 深い 満たす 重視 清水 今後 市場 甲信越 喜び リクルート 届け 戻る 無理 プロ 安心 プライバシー 販売 高級 サポート メイン 売る 四国 郵便 基準 連続 交通 期待 日々 置く 北陸 提案 控える 価値 目的 話題 ライブラリー 近く 心 高める 今回 平均 瀬田 下平間 選べる 教育 江戸川 済み はじまる さまざま 豊洲 集まる 食 リゾート 沖縄 たくさん より 事前 押上 ならでは 沼影 贅沢 半蔵門線 ホテル サイド 狛江 三郷 板橋区役所前 下鶴間 本当に シリーズ 代々木上原 東長沼 頂く セキュリティ 浜見平 戸神 武西学園台 子安 打瀬 平日 岩戸北 江ノ島線 根岸旭台 海浜幕張 北品川 赤 落合 日比谷線 前野 新曽南 よい 最高 設定 市川 元浜 契約 加藤新田 立花 平 嬉しい 追浜東 美浜 開催 普通 入れる 京成 イベント 土 変更 次 すぐ いっぱい 風 大切 綱 エア 完了 多摩川 鉄道 サービス 幸 伊達 時 パレ インペリアル 条 高速 方 入る 料 葉 武蔵野線 高田馬場 上野 大久保 伊勢崎線 位 習志野 京葉 特集 朝霞 東町 化 らい 世界 小豆沢 ヒルズ 先頭 グリーン 店舗 点 多く 件 月々 くれる 上野台 浜松 桜ヶ丘 現在 声 思う 管理 希望 南池袋 豊島 近隣 リスト 総合 行う こだわり 私 入居 医療 子 持つ 指定 買い物 名 肌 彩 全て 棟 新着 企業 トランク 所 専有 見学 始める 条件 自分 営業 必要 特別 初めて 最終 ランキング 商 こと スタイル 案内 以下 期間 使用 ブランド 部 こちら 人 その他 者 マップ 向け グループ メール せる 含む ため ない 紹介 ポリシー 規約 利用 ページ 情報 いる 登録 円 サイト 月 なる 中 する ある 問い合わせ できる 日
988	アメーバ 終了 間違う しれる 再度 いたす うえ リンク 下記 ご覧 オススメ 試し ヘルプ ホーム 指定 掲載 くださる 確認 探す トップ 特集 ページ いる なる
110	成分 健康 魚 サラサラ 青 粒 サントリー ゴマ 玄米 パワー 量 発揮 毎日 食品 税 食べる 魚油 届け 凝縮 若々しい 摂る 脂肪酸 酸化 勉強 目安 原料 ビタミン 食生活 精製 過ぎる 参考 歳 定期 考える ブルーベリー 刺身 方 男性 コース 入れる オメガ 出典 フェノール 人前 思う しっかり 補う 結構 ポリ 自ら 摂取 含有 科学 大豆 習慣 仕事 安全 研究 カプセル サラ 注意 パソコン おく 体調 原材料 送料 配合 品質 のち プラス 気 もの よう 大切 依頼 取り組み 工程 栄養 カート 手続き 徹底 働き 年末年始 本 続ける いつ 多い 飲む こと 除く ソフト 一時 通常 菜 力 方々 良い ケース ゼラチン サポート 内容 返品 それ 発見 解約 年齢 高齢 さらに 毎回 十分 食事 よく 迎える 製造 年間 れる 世界 商品 休み 別途 運動 水銀 日頃 赤身 多才 マイワシ マアジ 生食 表編 ダイオキシン ビジネスマン 便覧 僅か 固まる 済む クロマグロ 望ましい 入り 重ねる 活動 携帯 追求 生活 整える 交換 回 トク くださる 安心 分かる ため 購入 いたい 偏る 氷点下 積み重ねる ふんばる 頼り 訂 ハッキリ 劣化 ちか 聡明 アイデア 年配 胚芽 ミツバチ 増補 管理 高める 控える もう リズム ポリス 弱点 エネルギッシュ 比 乱れ 女王蜂 欠かす 保健 夫婦 取り除く より 特典 無料 質問 ％ 守る シリーズ 閉じ込める ご存知 蓄積 ショック さすが 足りる 分類 長径 稀少 文部 迷惑 てる 基本 オススメ 日本人 せっかく 白米 年代 視察 なに 目標 省 フタ 有用 前向き 一層 ひと 近年 うっかり 徳用 新鮮 自然 こちら かかる の 人 簡単 消費 含む ローヤル 長時間 製法 労働省 さける いける 負ける 不快 胃腸 作用 防止 小児 明らか 裏付け 昔 内臓 中高年 熱量 発疹 従来 減らす 分 詳細 以上 可能 理由 細かい カリウム 意欲 主食 （株） 補給 頑張る からだ 各地 相互 体内 ひとつ 定める 閉める 医者 支持 本来 相性 先頭 未満 ケア ん 愛飲 およそ ハイブリッド かゆみ 忙しい グリセリン 確定 やめる ゼリー リン 人数 厚生 志向 はじめる まれ 国産 涼しい 外食 経済 通院 たんぱく質 難しい 組み合わせる 大丈夫 濃度 授乳 性 用 時点 おかげ 編 努める 油 若い 適度 認める 正しい 脂質 生命 ナトリウム チャレンジ 原則 表 伝える 炭水化物 がち 文字 爽やか 学ぶ 味方 維持 薬 主 直射 日光 すでに あたり 吸収 妊娠 月末 せる 時間 さ 女性 変更 驚く 売上 加工 支える 透明 始める 間違い 高い 口 得 注文 標準 生 強い 不足 問題 処方 保管 バランス シェア 知識 厳しい 米 モバイル 取り入れる 計算 元気 体質 活かす 酸 心配 ヘア 読む 呼ぶ 生産 富士 朝 欠く 必須 テレビ 由来 揃う オンライン スキン 金額 発表 担当 出来る いう やすい アレルギー 価格 表示 マイ 確認 基準 期待 日々 友達 しまう とても 各種 季節 役立つ それぞれ ぜひ ところ 自信 目的 クリア 幅広い 少し カテゴリー はじめて 食 聞く 機関 違う 方針 一般 ごと 技術 独自 かける セキュリティ ヶ月 行く 事項 本当に 日間 応援 配送 何 家族 様々 よい 知る 豊富 ショップ 重要 プレゼント 受付 場合 一覧 合う 者 実際 基づく 見る 年 度 感じる ヘルプ アップ 用意 入る 目指す ら 声 サイズ たち これ 多く 際 内 くれる 地 環境 機能 こだわり 私 行う 総合 支払い いたす 様 設計 名 以内 もっと 採用 必要 新規 相談 自分 日本 メニュー 感 電話 会員 的 プロ お客様 戻る いただく 美容 うち 一部 可 ない 選ぶ ポイント 概要 部 られる マップ ガイド 上 法 プライバシー チェック 特定 取引 おすすめ 商 使用 トップ ログイン ポリシー 特集 利用 ページ 情報 登録 いる 円 会社 サイト なる 中 する ある 問い合わせ できる 日
980	土曜 祝日 神宮前 出荷 パスワード 受注 土日 水着 お盆 記憶 除く 休む 取り揃える 宛 係 コンピューター 流行 ファッション 通販 定休 発 不可 任せる 後払い Ｑ＆Ａ 安 審査 カゴ ビル 本日 名前 クレジット 当日 レディース 激 回答 メールアドレス 返送 服 忘れる 致す 必ず 外 丁目 発送 連絡 ご覧 平日 人気 場合 東京 ログイン 時 くださる 詳しい 店舗 際 番号 買い物 渋谷 行う ショッピング 株式会社 よく お気に入り 質問 注文 確認 おる アイテム マイ 都 こちら 対象 上 送料 概要 区 ガイド 検索 会員 規約 期間 商品 トップ 方 利用 ページ 情報 登録 いる 会社 サイト する ある 問い合わせ
985	静岡 指定 げん 求人 すき 酒場 バイト 福祉 アルバイト 正社員 株式会社 介護 応援 問 家 企画 探す 公式 仕事 医療 ない エリア さん 沼津 昌 サンデーフォークプロモーション クレディセゾン 錦 炙る 志太 岡町 蒲原 パソナ ミス・ユニバース 富士宮 榛原 日乃出 ジュビロ磐田 （有） 新しい 条件 居酒屋 店 松本 パルコ ジャパン 購読 工業 推す ワーキング 本店 タイムス 富士 登用 せい ろ 読者 事務所 清水 ナイト 急募 合わせる 現在地 積極 アカウント 株 就職 制度 クリア ファン 職場 フォロー 押す 学生 園 勤務 キープ 経験 今週 職種 デビュー 活躍 版 フード ワード 定期 ヘルプ 履歴 浜松 フリー 地 こだわり ホーム 営業 京 採用 注目 室 所 始める 企業 相談 いい 特別 マイ 案内 特集 北 お知らせ 概要 町 女性 方法 マップ 検索 販売 おすすめ 個人 サービス 表示 掲載 規約 会員 利用 ページ 情報 登録 いる 会社 サイト なる する ある
846	メンズ 税 夏 シャツ アイテム カッコ 消費 ビジネス カジュアル 服 香水 セレクト ファッション 入荷 女の子 パンツ オシャレ シューズ 使える 兼ね備える ショップ ベルト スタイル 鞄 ネクタイ チノ グッズ 公式 通販 コーディネート ポロシャツ ラフ 季節 パーカー アク パスワード 一覧 デニム てる よい 上手 パン 着る 忘れる しまう 小物 サンダル くれる 仕上げる セ 魅せる 楽しむ 男 爽やか ジャケット さ 感 やっぱり デザイン スラックス お済み ワイシャツ フェラーリ ヤード ブレザー ウケる ウケ 私服 レイ ミニチュア 取り入れる 土日 カーディガン 買いもの 大文字 染め アンダー 厳選 提案 入力 ジャ 答え ハーフ 小文字 バッチリ 毎日 新作 カート いい 枚 マリン 社長 ほのか 時計 マフラー 香る 回す 更新 つけ ８月 切り替え ガード ストール 入れる ピックアップ ポイント 賢い 英数字 ドット 翌日 手 カテゴリ ブレスレット ビーチ こなす ベスト 半角 無地 最短 財布 ネックレス ドレス 編 カラー セット まだ 半袖 やわらかい 役 売れる 会員 特集 シルエット 法律 文字 タンク 人気 ショッピング さらに 加工 質問 ニット く 頂ける 今日 メールアドレス ブーツ 秘密 コレクション 祝 ウェア お客様 見る 見える 率 着 印象 大人気 方針 頂く 様々 開催 人 区別 ガイド 合う くださる れる ログイン 方 仕事 美 バッグ 最新 海 柄 本 良い コート 全て 持つ いく 注意 保護 街 もっと お気に入り よく 高い 合わせる ランキング 詳細 戻る 届け よう 表示 選ぶ トップ その他 概要 基づく 検索 商品 使用 個人 探す サービス 時 商 特定 取引 年 ない 利用 情報 登録 円 会社 サイト 月 中 する ある 問い合わせ 日
118	大地 守る 会 試し 試す 全国 メリット セット 基本 送料 限定 すぐ 無料 期間 今 円
