896	期 面積 専有 間取り 徒歩 プレゼント 対象 台 区 線 販売 市 分 ＪＲ 県 パーク 神奈川 東京 都 見学 川崎 可 レジデンス 横浜 未定 ハウス 町 予約 千葉 マンション 先着 新築 デュオ 順 中央 ガーデン 埼玉 浦和 戸塚 本線 住戸 納戸 ヒルズ 山手 横須賀 シティ 次 追浜 号室 プロジェクト 北 エリア メトロ モデルルーム 京浜東北 北浦和 以下 テラス 街 杜 京 桜新 八千代 緑が丘 ホームズ 港 奏 津田沼 ルーム タワー 上石神井 川口 稲毛 西武 朝霞 濱 さいたま 東 バス 新宿 トランク 新川崎 恵比寿 ライオンズ 三田 流山 景 茅ヶ崎 田園都市線 埼京線 戸田公園 月々 返済 東急 ヒル ニュータウン 戸田 芝浦 横 番 東海道 渋谷 戸 公園 新子安 森 西新宿 武蔵 上麻生 小川 石神井台 淵野辺 東綾瀬 小仲台 鷲宮 小平 含む たま ブリ 南 リア 祐天寺 キャンパス 馬車 成城 渡 幸 東大島 大山 上鷺宮 府中 芝 新地 上大岡 柏の葉 東上 後楽園 ふじみ野 大師河原 常盤 ときわ台 板橋 ステージ 鶴間 小石川 小田急 まとめる 棟 東武 道 子 大宮 コート 都営 北山田 仮称 最終 稲城 ブライト 六義園 林間 ナス 汐見台 アル 小規模 追浜東 高崎 練馬 ペット 物件 予定 トップ うち 志村 伊達 田町 パークマンション 京王 千代田 大師 世田谷 太陽光 坂 綱 南北 南山 大和 港北 相模原 多摩川 エア ロイヤル 地震 インペリアル 習志野 未満 坂上 文京 駒込 つくば 幕張 当該 上野台 二子 勝どき 角 シーズン ウエスト 加賀 翠 桜ヶ丘 期日 エクスプレス 部屋 晴海 丸ノ内線 彩 ビッグ 入居 設計 対策 リスト 関東 池袋 聖蹟 小田栄 羽 浮間 スタイル 一部 資料 北綾瀬 価格 東大成 プロ 駒沢 四谷 久喜 桜田 小倉 茗荷谷 泉水 拝島線 舞岡 東大和 都筑 東習志野 実籾 矢向 東砂 北加瀬 上矢部 若柴 中央林間 借地 新石川 金山 大滝 つきみ野 南町 下平間 成城学園 沼影 足立 五本木 関 青葉 赤 南武線 柿生 下鶴間 前野 アトリエ 宇都宮線 新曽南 東長沼 港町 代々木上原 麻生 浜見平 海浜幕張 総武 江ノ島線 根岸旭台 イースト 戸神 目黒 石 打瀬 領家 市が尾 ハナ 春日部 川浜 松戸 矢部 権 総武線 神明 おう 根岸 新白岡 等々力 武蔵新城 上本郷 付属 サー 元浜 別所 検見 お花茶屋 若宮 請求 元町 みなとみらい 美浜 普通 版 高津 区別 京成 草加 現状 すぐ 道路 変更 産業 麻布 新横浜 志木 鎌倉 前 上福岡 前橋 東急東横 探す 中野 ミソ らい 学芸 多摩 日本橋堀留 本町 レ 大路 パレ 総 鉄道 姿 富士見台 京葉 葉 有 高速 勝島 ラ 南流山 大久保 高田馬場 上野 印西 蓮根 玉川 快速 西葛西 新三郷 四季 越谷 ゲート オーク 江東 大崎 栃木 パス 行徳 有明 柏 学園 八王子 グリーン 大江戸 浜松 喜多見 小豆沢 海 帯 ワンダフル 茨城 南池袋 テーマ 品川 都市 磯子 地下 目安 ライン 都心 豊島 大学 近隣 号 室 駅 通り 西 所 プレミアム 期間 使用 不動産 リクルート 時 特集 センター おすすめ チェック 年 今 他 階 部 マップ 受付 その他 向け グループ 掲載 こと 以上 ポリシー 紹介 特定 サービス プライバシー 規約 利用 ページ 情報 円 会社 サイト 月 なる 中 する ある 問い合わせ できる 日
781	期 面積 専有 間取り 徒歩 プレゼント 対象 台 線 区 東京 都 販売 パーク ＪＲ 分 市 レジデンス 見学 未定 県 可 ハウス 横浜 千葉 町 予約 マンション 神奈川 新築 中央 デュオ 川崎 納戸 埼玉 桜新 ガーデン 山手 浦和 ヒルズ 次 シティ 住戸 メトロ 高崎 先着 モデルルーム 世田谷 ルーム 北浦和 三田 板橋 加賀 号室 杜 トランク プロジェクト 順 エリア 戸塚 流山 東急 以下 緑が丘 八千代 等々力 汐見台 津田沼 森 ホームズ 奏 都営 志木 草加 西武 朝霞 北 蓮根 上石神井 新宿 テラス 街 田園都市線 埼京線 月々 返済 芝浦 新三郷 恵比寿 ニュータウン 景 八王子 含む 西新宿 戸 渋谷 晴海 コート 京浜東北 東武 横須賀 タワー 石神井台 東綾瀬 小川 淵野辺 神明 小平 上麻生 お花茶屋 武蔵新城 新白岡 仮称 南流山 祐天寺 日本橋堀留 本町 学芸 濱 成城 渡 キャンパス さいたま 柏の葉 上鷺宮 大山 千代田 玉川 東大島 大崎 東上 つくば ヒル 常盤 小石川 ライオンズ 後楽園 ふじみ野 横 柏 新川崎 二子 ステージ 喜多見 エクスプレス 戸田公園 小田急 まとめる 港 公園 磯子 棟 大学 番 北山田 リア バス 東 ブリ 南 稲城 小規模 林間 ナス アル 川浜 六義園 検見 別所 ブライト 美浜 東急東横 ペット 練馬 坂 綱 予定 ミソ 地震 志村 うち 相模原 エア 京葉 南山 南北 ラ インペリアル 港北 伊達 幸 物件 パークマンション 田町 桜ヶ丘 ら 角 勝どき 上野台 行徳 四季 学園 坂上 期日 幕張 オーク 当該 戸田 駒込 追浜 文京 未満 翠 部屋 武蔵 品川 本線 入居 設計 リスト 丸ノ内線 彩 対策 トップ 価格 前 池袋 関東 駅 通り 白鳥 羽 浮間 高岩 白岡 九蔵 一部 中浦 資料 北綾瀬 駒沢 真砂 検見川 小伝馬 葛飾 茗荷谷 浜 拝島線 大井 北加瀬 東砂 都筑 泉水 東大和 瀬田 中央林間 若柴 南町 借地 下平間 上矢部 つきみ野 桜ケ丘 関 保土ヶ谷 足立 五本木 野沢 成城学園 保土ケ谷 打瀬 宇都宮線 戸神 板橋区役所前 柿生 南武線 赤 北品川 石 目黒 アトリエ 日比谷線 麻生 東長沼 代々木上原 子安 三郷 狛江 海浜幕張 岩戸北 根岸旭台 和 春日部 市川 上本郷 加藤新田 ハナ 若宮 付属 サー 市が尾 領家 総武線 妙典 松戸 小仲台 根岸 おう 権 矢部 鷲宮 麻布 新横浜 すぐ 現状 前橋 群馬 たま 変更 常磐 普通 コミュニティ 上福岡 鎌倉 京成 区別 請求 版 高津 習志野 総 川口 鉄道 パレ 稲毛 府中 大和 富士見台 多摩川 芝 レ 京王 姿 快速 らい 中野 探す 西葛西 高速 勝島 条 馬車 使用 太陽光 大路 有 葉 武蔵野線 ロイヤル 大久保 伊勢崎線 上野 高田馬場 印西 上大岡 新地 多摩 ゲート ときわ台 有明 江東 小豆沢 茅ヶ崎 栃木 パス ウエスト グリーン シーズン 大江戸 東西線 大師河原 鶴間 越谷 ビッグ 南池袋 地下 目安 帯 ワンダフル 茨城 豊島 近隣 東海道 都市 新子安 子 大宮 道 テーマ 都心 ライン 西 最終 プレミアム 所 新作 リクルート 時 特集 今 センター チェック 年 おすすめ 期間 他 スタイル 階 不動産 プロ マップ その他 グループ 向け 部 紹介 ポリシー 特定 以上 掲載 プライバシー 規約 サービス 利用 ページ 情報 円 会社 サイト 月 なる 中 する ある 問い合わせ できる 日
782	大奥 女 乱 視聴 配信 スペシャル 期限 章 華 購入 たち 幕末 分 劇 将軍 牢獄 愛憎 ドラマ 物語 映画 時間 話 描く パック 江戸城 結婚 ひとつ 姫君 時 再会 年 シリーズ 場面 時代 舞台 繰り広げる もう 部 編 感動 明治 磨 ねらう 怪談 博太郎 輿入れ 忍び寄る 信吾 暗殺 紅蓮の炎 篤子 紋付 上様 ふた 春日局 鷲尾 池脇 ふたたび 龍二 真知子 壮絶 予感 いかに 凶事 嫉妬 葛山 鳴る 義徳 みゆき 鈴 霊 ゆう子 家定 寝所 一輝 千鶴 久保田 束の間 野際 北村 瀧山 別離 フジテレビ まるごと 一部 れる 江 小松 萬 美穂 陰謀 出陣 陽子 原田 生き抜く 篇 花開く 本田 香緒里 未婚 集大成 哲夫 嵐 二度と 暴く ゆ 死す 森下 ライブラリー とき 過去 岡田 禁断 涙す 潜む 闘い 夫婦 浅野 旅立ち 菅野 紅 決断 再び 木村 関連 希 記録 現代 真相 奇跡 彼女 山口 ヒット 運命 愛す 裏切る 江戸 代 出逢う 帰る 来る 黒 恋 原点 弾 キャスト ついに 文化 ＦＡＱ レコード ストーリー 製作 許諾 呼ぶ エピソード 一気に 始まる 満たす 商標 操作 リンク すべて ホームページ カレンダー 率 示す 映像 それぞれ 今回 計画 番組 多い スーパー ここ エル 見つかる 最高 知る 更新 コンテンツ られる の 重要 理由 完了 本 マーク 件 子 番号 提供 日本 京 新規 くる メニュー 特別 表記 方 見る 表示 トップ あなた 基づく 含む お知らせ 女性 ガイド 会員 特定 取引 紹介 期間 ログイン 商 利用 ページ いる 登録 会社 月 なる 中 する ある 問い合わせ 日
783	自主 回収 ホリスティック かぐ 製品 アイテム 一覧 症状 ビューティー 発症 花島 何卒 掛ける 不便 湿疹 シリーズ 申し上げる 耳 ヘア 頭 赤み 首 検査 理解 該当 雑誌 かゆみ れる 追加 ダメージ いたす ケース 皮膚 周り 究明 期す 要す 未だ 今般 ぐれる ケア アレルギー 判明 協議 顔 原因 特約 決定 新着 ご覧 頂く 至る お願い 更新 万全 キット 位 詳しい お客様 ランキング 参る 同様 ストア 行う 対象 こちら お知らせ うえ カート お気に入り 確保 トライアル 以外 募集 オンライン 弊社 詳細 よう マイ 取り扱い モデル 機関 マガジン 写真 受ける 安全 スタッフ ショップ 返品 関連 予約 つく ログイン 掲載 こと くださる カテゴリ 公式 ホーム 全て 性 等 メニュー 毎日 対応 新作 号 使用 おる 確認 ブランド 特集 いただく 方 ため 検索 時間 メール せる ガイド 購入 版 概要 基づく 商品 個人 おすすめ 会員 特定 取引 表示 商 利用 ページ 情報 登録 いる 会社 月 する 問い合わせ できる
784	スニーカー 厚底 ヒール 消費 弾 イン 税込 税 入り インライン バイ 価格 定価 お手数 服装 トレンド フレーム 無地 ボーダー 衝撃 予約 替える 対応 均一 垢抜ける オールマイティー 言うまでもない 今期 足元 切り替える 並び 順 一味 部分 ところ 正しく 迷彩 ご覧 セール 履ける 一足 使い 近年 綺麗 友 販売 付き アイテム ストレス 切替 優 押さえる 相性 ファッション 通販 入荷 カテゴリ 変動 栄子 新川 菜 Ｑ＆Ａ カラー カゴ 全品 紗 レディース 間違い 抜群 鈴木 着用 セレクト 愛 靴 カジュアル 与える プラス 着る いつも レビュー 買い上げ よろしい よう スタイル いう 使う 安い サンダル 記載 印象 ログアウト シューズ 取扱い 停止 ショップ 下さる イベント 一覧 限定 送料 活躍 申込 柄 くれる 目 買い物 持つ 用 支払い ホーム 新作 もっと カート 注目 いただける みる 新着 高い 見る くださる ランキング マイ 特集 確認 期間 選ぶ 法 概要 場合 ガイド 検索 の 版 基づく 方法 ログイン 商品 こと 商 以上 特定 ない 取引 個人 表示 時 利用 ページ 情報 いる 円 会社 なる する ある
786	温泉 夕 朝食 宿 空 点 プラン 河津 本館 貸し切り 件 付き 名 室 和室 貸切 鬼怒川 川治 露天 湯西川 座 源泉 風呂 詳細 確認 草津 限定 亭 特典 会席 東伊豆 稲取 白壁 湯けむり 石花 柏屋 りょう 舘 流し 鬼怒川温泉ホテル 掛け 山県 樟 巨木 露天風呂 玉 畳 海 静岡 県 日進 苑 月見 今井 里 食 北川 日本一 直す デート 熱 館 禁煙 オズ 見る 山梨 おまかせ らん 新井 宿泊 荘 川 予約 料理 浴衣 条件 浴場 星空 竜 土肥 伊豆 熱海 北軽井沢 民芸 川浦 伊豆長岡 西伊豆 万葉 天城湯ヶ島 嬬恋 中伊豆 修善寺 薬師 渓谷 笛吹 栃木 ヘルシー 伊東 厳選 浜 選べる 創作 焼 夕食 クリスマス 箱根 堂 占める 園 リゾート モール 石 数 尻 色 付 ダイニング 島 群馬 消費 長 流す レンタル 無料 閉じる 年度 該当 お出かけ ツイン 和洋 ふたり 湯 投稿 望む 部屋 税 プライス 調和 検索 女子 広々 ％ プレミアム 年間 旅行 編集 込み 選ぶ 分 見える メイン 友達 あり 種 過去 かける 通常 料金 誕生 前 一覧 結果 料 位 目 コース 戸田 会 こだわり 表記 ルーム もの 次 含む 人気 部 特集 サービス 時 ページ 円 なる する 日
648	ブラ カップ ワコール 谷間 お買い得 パッド レース ワイヤー サテン ラッセル 盛る 寄せる 下限 フラワー 絞り込み 肌着 上限 ブランド 付 ちゃう なれる タイプ 柄 ウェア 検索 スカラップ キーワード セール 配色 アイテム ワード ギンガム ストライプ サイズ 件 フリー 刺繍 件数 プリント モチーフ カラー ホーム プライス 小さい メイク モード 替える カート お気に入り 見せる モダン 並び 表示 価格 会員 ルーム ランキング スペシャル 花 取扱い ログアウト 次 一覧 商品 最新 登場 新規 みる 注目 企業 もっと チェック 順 人気 ガイド 方法 版 ログイン 規約 おすすめ 個人 利用 ページ 情報 登録 問い合わせ
787	期 専有 面積 間取り ＪＲ 東京 小杉 プレゼント 対象 徒歩 線 横浜 津田沼 奏 磯子 区 プロジェクト パーク 杜 新子安 開発 西新宿 都 レジデンス 未定 神奈川 山手 販売 分 大崎 複合 シティ ハウス まとめる 晴海 武蔵 次 県 市 物件 マンション 京浜東北 ワンダフル 中丸子 中原 リア バス ブリ 仮称 ガーデン 新宿 将来 全戸 資料 タワー 期待 価値 豊洲 北品川 総武線 請求 エリア 習志野 高田馬場 大久保 快速 江東 メトロ 地下 丸ノ内線 横須賀 品川 川崎 納戸 千葉 街 トランク 見学 チェック トップ ルーム リクルート 特集 選ぶ 新築 不動産 階 中央 可 マップ 含む 予約 向け グループ 規約 掲載 ポリシー 紹介 プライバシー 利用 ページ 情報 円 会社 サイト する 問い合わせ できる
649	税 税込 系 閉じる 裾 あと 展望 夢 肩 ワンピース 位 カテゴリ リボン 一覧 別 検索 襟 背中 レース 魅せる 保存 シルエット ベルト 解除 許可 付き 履歴 柄 ブランド 価格 編み込む 丸襟 幾何 Tシャツ カラー サンダル ネオン パステル バリ 使い 透かし スリット ディテール トロ 重要 ショー パン 羽織り カラ ガール お嬢様 アイテム ワード 見る 販売 ランキング 切替 アピール 生地 柔らかい ブラ サイズ 刺繍 フレア 衣類 単品 ゆるい クス プリズム 袖 プリモ 正会員 羅 ピッ ビキニ モンスター セット スニーカー 全て サマー 夏季 シルバー チョコレート 高度 ボーダー 休暇 ブラウン 用語 ゴールド チュニック 気分 お知らせ 送料 スーツ ストーン 引き レッド お気に入り 結婚式 グレー ベージュ メニュー カート 注目 新作 ビューティー 激 デイリー ピンク 問合せ 方式 イエロー フラワー 均一 デニム 集 計算 オレンジ カット 満載 ブーツ 水着 売れ筋 靴 ホワイト カジュアル 学 ブラック パンプス 業 動画 演出 機器 買い上げ コレクション 詳細 作 大きい カテゴリー 小物 トレンド インナー ハリ ブルー 発送 リゾート 問 花 スカート シューズ てる コーディネート 最近 付 色 手数料 ガイド レ 商品 パンツ デザイン 美 入荷 プラン 点 バッグ グリーン 総合 ライン 番号 管理 会 医療 ショッピング 等 表記 号 もっと ポイント 無料 特集 トップ 合わせる 次 その他 変更 プレゼント 法 基づく ポリシー 期間 以上 れる 商 ログイン 取引 特定 プライバシー 規約 会員 サービス おすすめ 利用 情報 いる 登録 円 会社 サイト 中 する ある 日
195	取り扱う ジャパン 銀行 ホームページ ネット 閉じる いたす おる
194	化粧下 ファンデーション サンプル 最適 プラス 地 夏 応募 トク 実施 たくさん 見つかる 終了 プレゼント キャンペーン セット 他 中 する
197	便 定期 タカ ミ 年中 無休 届け 次回 申込む 通話 お客 事前 正しい 下さる 相談 さま 仕組み 留守 メールアドレス ヵ月 携帯 角質 長期間 外出 荷物 取り扱い 室 宛 途中 申し上げる こちら 確実 回 予定 料 かご 一律 本来 ケア 承る 最初 不安 肌 お送り 解約 自動 ため お知らせ メール 習慣 電話 よく 質問 休み クイック 毎月 こんなに 商標 可 案内 いただく 製品 安心 届く 液 以降 多い 特徴 お願い 知る 受付 送料 前 規約 こと 無料 化粧 実感 用意 詳しい 全国 店舗 続ける 未満 目 美しい いたす 支払い 得 株式会社 表記 カート 税込 もっと 毎日 おる 確認 マイ 見る マップ 方法 一覧 の 変更 購入 法 基づく 場合 さ おすすめ 取引 特定 個人 トップ ログイン 商 以上 れる 利用 ページ 情報 登録 いる 円 会社 サイト する ある できる 日
191	幅 マチ 取り外し 実寸 ポケット サイズ 再販 レビュー 付き 度 ルックス ファスナー 合金 南京錠 完売 切り替える 商品 タンブラー クラシカル ショルダー 使い勝手 文句 開ける 飾り 説明 スナップ 鍵 縦 弁当 知らせる 次第 ひとつ 非公開 フリー 件 件数 投稿 モチーフ 余裕 まま 軽い 周り カバー 気分 書類 通学 書く 自慢 お気に入り さらに 見た目 数量 通勤 内側 仕様 よろしい オープン 可能 おしゃれ 使う 高級 友達 平均 長い 雑誌 魅力 済み サイド 取扱い ログアウト オススメ 停止 予約 実際 さ 素材 メール 申込 評価 入る 入荷 横 手 カテゴリ バッグ 仕事 支払い 持つ ホーム 全て 用 カラー 特別 感 高い カート 表記 税込 スタイル やすい 合わせる マイ 送料 検索 法 プレゼント 基づく 者 方法 一覧 版 購入 さん お知らせ 時 ログイン 分 販売 見る 表示 価格 個人 ない 年 特定 取引 おすすめ 商 れる 期間 ページ 情報 登録 円 月 なる する ある 問い合わせ 日
190	すっぽん 良質 小町 アミノ酸 返品 定期 コース すてき 袋 申し込む ミニ 得 初回 倍 質 酢 毎 高級 フリーダイヤル つくる グリセリン の もらえる 承る 健康 ヶ月 黒 キレイ 開封 毎回 つく 血統 祝日 土日 当社 くれる 調べ 限定 受付 愛情 一家 ウィークリー 鵜 激減 積み重ね 銀賞 エサ ｍｇ 平均 たい せつに いったい 贅沢 一般 事前 れる 税込 追加 連絡 ご存知 オススメ 公益社 魚油 ていねい 重要 量 送料 面白い 粉末 エステル 断然 扱う 生成 育つ 飲用 内容 キャンペーン 団 受賞 混ぜる 年度 必見 努力 万が一 脂肪酸 ん 外部 どうぞ 証 部門 側 はじめる 値 働きかける 経済 想い 国産 つながる セット 築地 かねる おかげ 総合 便利 ゼラチン いろいろ 協会 どれ 含有 摂取 優れる 粒 保つ 吸収 プレゼント 時間 もらう 習慣 過ぎる 大変 受け継ぐ あらかじめ もっと いい ％ 通 すごい 頂ける 元気 まるごと そのまま 生産 朝 保証 欠く 富士 原材料 売れ筋 一切 認定 市場 安心 的 届け こと 選ぶ 商品 ビタミン にくい 必ず しまう 日々 体 法人 話 ぜひ 突破 今回 ところ 通信 多い 受ける たくさん 発送 負担 本当に 状態 安全 申し込み 作る 付 豊富 満足 こだわる 誕生 含む 品質 言う せる 試し 女性 こちら くださる 無料 年 了承 歳 位 目指す マーク 通販 美しい 内 多く 環境 代 続ける 生活 際 以内 いく 水 こだわり 番号 良い 思う いただける 日本 さらに みる 注文 ショッピング 品 いただく すべて おる ランキング 販売 回 使用 ブランド 場合 東京 後 者 さ 上 ため さん 分 会員 今 以上 サービス プライバシー 方 ない 期間 利用 いる 円 月 なる 中 する ある できる 日
