286	丈 ネット パンツ 限定 分 サイズ 息子 ポケット 投稿 可愛い グレー ぐるり 在庫 幅 評価 男の子 発売 指定 綿 表 税込 伸縮 多少 製品 歳 購入 商品 日時 ヶ月 カラー ブランド 足 下さる 口 イエロー 股上 さる スマイル インパクト 穿く 股下 きおう 個中 少々 縫製 ひろ 可否 ふつう ただいま 数量 順 ポイント アイテム さん センチ 誤差 細め 歪む ポリウレタン 惹く 部分 立体 大きめ 微妙 本体 糸 ゆったり キーワード 違う お気に入り 通常 楽しむ ポリエステル 風合い たん 身長 測定 もうすぐ 味わえる 腰 才 評判 洗い 店頭 やはり アンド キャラ 選択 開始 レモン シワ 残り りゅう 同時 予定 デザイン 選ぶ 拡大 かご 楽 生地 履く お待ち 梱 ウエスト 際 体重 ロゴ 薄い 不可 無地 単品 注意 買い物 性 生じる 適度 やわらかい 見る シルエット 軽い 周り タンク ぴったり 検索 為 引き 書く ちる 等 加工 あらかじめ 当日 楽しみ フロント 子供 雰囲気 大 仕様 着る ママ 個 事 レビュー 価格 確認 かわいい 取り扱い 置く モデル 物 とても Tシャツ 楽しめる 取得 状況 発送 ごと セキュリティ 何 枚 事項 状態 スタッフ 平 手数料 買う 特徴 の 入れる せる そう 予約 素材 前 送料 言う 会員 了承 くださる 販売 ござる 店舗 代 これ ホーム 番号 夏 もっと 新作 カート みる 特別 いい 年 詳細 スタイル 他 的 おすすめ 案内 時 やすい 使う ログイン 期間 表示 られる 概要 基づく 人 ガイド 法 後 人気 ポリシー 無料 取引 特定 チェック プライバシー トップ こと 商 れる 以上 規約 利用 情報 いる 登録 円 サイト 会社 月 する ある 問い合わせ できる 日
1010	期 面積 間取り 専有 台 徒歩 プレゼント 対象 区 販売 パーク 線 千葉 分 マンション エリア 市 県 横須賀 東京 流山 以下 ＪＲ 川崎 中央 タワー 都 シティ 神奈川 加賀 新三郷 越谷 ホームズ 森 プロジェクト 横浜 未定 テラス 見学 街 埼玉 南流山 追浜 ふじみ野 ハウス 可 次 あり 品川 都営 住戸 規模 リア ブリ 仮称 ガーデン レジデンス 予約 勝島 武蔵野線 予定 渡 地震 新川崎 三田 上野台 エクスプレス つくば 板橋 柏 行徳 ら ニュータウン モデルルーム 対策 奏 入居 津田沼 棟 本線 京 先着 トランク 南 杜 山手 ルーム 特集 順 物件 北 まとめる 北加瀬 大滝 かう 板橋区役所前 三郷 りん シーサイド おう 妙典 市川 加藤新田 含む 町 常磐 上福岡 追浜東 すぐ 現状 有 ミソ 柏の葉 志村 幸 川口 田町 東大島 千代田 東町 姿 上野 探す キャンパス 芝 ラ 新地 上大岡 八王子 大江戸 東西線 期日 小豆沢 有明 学園 ときわ台 ライオンズ 坂上 大師河原 ゲート オーク 幕張 当該 桜ヶ丘 芝浦 鶴間 栃木 東上 勝どき 浦和 茅ヶ崎 戸田公園 喜多見 子 メトロ 豊島 東武 近隣 ビッグ 港 コート 南池袋 晴海 都心 茨城 番 都市 磯子 地下 新子安 西新宿 武蔵 ワンダフル 帯 テーマ プレミアム 池袋 西 納戸 関東 バス 通り 東 うち 価格 不動産 リクルート 階 資料 トップ 今 向け グループ マップ 請求 部 版 その他 使用 プライバシー 以上 規約 ポリシー 期間 掲載 チェック 年 紹介 利用 ページ 情報 円 会社 サイト 月 なる する 問い合わせ できる 日
1281	準拠 賞品 バトル 裁判 欠陥 クリック 生じる 管轄 紛争 トラブル 第三者 事項 性 関連 発生 者 キャンペーン 受領 投票 いかん ハードウェア 水着 場合 細心 下旬 遂行 審 国法 完全 誤る 裁判所 被る 負う 地方裁判所 発送 等 連絡 事故 オシ みなす 遅延 当選 抽選 有用 中断 手段 間 正確 全般 払う イチ 接続 かかわる ソフトウェア 損害 結果 券 専属 免責 買物 獲得 かねる 責任 提供 注意 再生 収集 応じる 送信 今年 あらかじめ ついに 同意 解決 保証 応募 送る 発表 頃 リンク 下記 もの いただく 取り扱い 各種 目的 プログラム 原因 決定 安全 数 みんな その他 コンテンツ 法 せる 了承 理由 様 ホーム 全て 日本 お客様 確認 個人 よう サービス 選ぶ すべて られる 東京 含む メール 上 掲載 規約 れる くださる 利用 情報 いる 月 サイト する ある 問い合わせ できる
473	日替わり タイム 実施 セール スタート 毎日 カレッジ クラッチ タック アイテム 税込 商品 柄物 先週 夏 ムービー 着こなす アップデート リナ 藤井 か月 同時 パンツ プロモーション 必見 バッグ メンバー オシャレ スタイリング スタイリスト 涼しい 合計 春 完売 彩る 買い上げ Tシャツ 発売 大人気 公開 楽しむ 紹介 キャンペーン 点 最新 柄 入荷 リスト 新しい さらに 新着 新作 あなた 選ぶ 使う ランキング 送料 人気 購入 特集 販売 無料 チェック 方 今 以上 いる 中 する
1384	徒歩 広い 所在地 駅 交通 邸 地下鉄 神戸 分 物件 阪急 間取り 京都 資料 大阪 詳細 施設 誕生 線 請求 市 さ アクセス 利便 梅田 圏 町 区 向き ロケーション 天王寺 台 阿倍野 御堂筋 価格 見る 無料 住環境 レジデンス 未定 街 納戸 豊中 生活 阪神 谷町 充実 公園 草津 快適 千里 南 本線 駅前 ロジェ 通 五条 住宅 更 多彩 立地 開放 烏丸線 堺 スーパー 緑 揃う 中央 分の 三宮 長岡京 文の里 西宮北口 桃山台 商業 豊か 芦屋 子育て 南森 西宮 都心 病院 ＪＲ 暮らし 性 教育 プロジェクト 始動 点在 小学校 住吉 烏丸 東海道 便利 贈る マンション 大型 市内 中心 魅力 圏内 神崎川 洛 京阪本線 帝塚山 関目 中之島 淀屋橋 南堀江 長堀 住戸 川 心斎橋 直結 検討 地上 ルーム 北千里 御影 最大 千里丘 吹田 鶴見緑地線 設備 感 面積 周辺 建 率 直通 角 ％ 中学校 駐車 身近 王寺 西田辺 西洞院 元町通 河原町 今福 急行 リスト 享受 閑静 停車駅 路線 自然 いよいよ 四条 フラット プラン 筋 プランニング 住 タワー 仮称 北大阪 家族 走る 仁川 南千里 今出川 阪南 ハイム 伊丹 歩 鶴見 地 環境 震 昭和 ユニ 石橋 祇園 エリア はじめ 宝塚 パーク 住友不動産 場 不動産 可能 快速 全戸 春日野道 千里線 高台 和泉 住む 近接 フロア 上質 ライフ 御池 淀川 大阪環状線 あべの 少路 塚本 布施 東山 香里園 平面 風情 東三国 山本通 先進 高殿 千里山 北大路 都市 モデルルーム 式 フリー 新築 創造 西 高層 超 ファミリー 西口 北浜 田辺 松屋 京阪 心地よい 免 潤い なんば 階 ハウス 予定 トランク 登場 東灘 住まい 空間 あふれる 停車 住居 丘 確認 可 広がる 敷地 穏やか 良好 邸宅 府 三明 八坂 森ノ宮 市立 朝潮橋 西神中央 下京 麩 守口 暮らせる 御影中 光明池 阪和 嵐山 南船場 大石 嵯峨 法円坂 京橋 池田 集積 分譲 機能 バリエーション 沿い 院 林田 規模 入れる シティ れる 確保 日常 中京 通勤 兵庫 賃貸 ライフスタイル 歴史 関西 保存 道 オープン 屋 大人 デビュー 三ノ宮 市外 制 優れる 景観 私邸 低層 買える 地区 丁目 級 開始 奥まる ランド 恵まれる 機関 リバー 一戸建て 近い 期 モール 収納 文化 文教 中古 学校 含む 型 中津 泉北 伏見桃山 夙川 谷町線 住之江 大阪城公園 藤白台 御門 庄内 今津線 星陵台 堂島 サンマ 岡崎 油小路 神南 安堂寺 郷 中崎 下鴨 左京 エルグ 四つ橋線 美しい 仕様 額 ノース 長尾 楽園 玉造 苦 実現 付 初 発表 暮らす 枚方 ショッピング ガーデン テラス 北 天神 応える 元町 後 タイプ 普段 開発 ビッグ 神 独立 通る 落ち着く 高める 鉄道 高速 古江台 城東 千里中央 積水ハウス 成熟 角地 眺望 隣接 共用 特急 近鉄 デッキ 南東 愉しい 抱く 公開 面接 建て 王子 目 的 育む 採用 浜町 寄り添う 高い ワイド さくら 完備 嬉しい 豊富 主要 溢れる 戸 ホームズ 使い方 リフォーム イオン セレクト スムーズ 奈良 前 専用 これから 県 レポート 始まる イン 整備 複合 包む まとめる 気 安心 大路 レース 構造 東 毎日 専有 等 新しい エコ 楽しめる 堀江 ビスタ 長堀橋 レフ 美章園 上町 寺田 東梅田 アリーナ 淡路 賑わい 通風 西長堀 幹線 桃谷 四天王寺 メトロポリス 公園通り 鶴見緑地 住ノ江 門戸 永住 爽快 上京 藤森 打出 平屋 魚崎 受電 方角 迎賓 東川崎 西大路 路 夕陽丘 三方 堂ヶ芝 三津屋北 芦屋川 神祇官 ジーク 南海本線 灘 佇まい 市役所前 万代 あかり 北摂 丸太 一望 採光 厄神 苦楽園口 西入 見据える 阪急不動産 北野 甲陽線 六甲山 新開地 ファミリア 阿波座 各駅 樋之池 脇浜 伏見 垂水 真田山 内 東西線 代 清流 折々 買物 華やかさ パレス 広場 もたらす 計画 洗練 電鉄 うれしい 受付 次世代 クラス 高圧 絵 高野 南海 居住 地域 薫る みち 漂う セキュリティ システム 振る ゴミ 設計 老舗 おもてなし 立花 使い 特徴 様々 今福東 福島 関西本線 ファースト 華やか 接 台地 始発駅 見積もり 寛ぐ 四方 庭 東急不動産 堂々 ぶり 南側 風致 装備 ポジション 廊下 大通り みんな コミュニティ グランド 三菱地所 待望 導入 叶う 通学 京 山手 位置 現地 商店 引越し 戸数 通り さらに 並み 百貨店 並ぶ 満喫 幼稚園 両立 古い 用意 感じる 条 理由 本町 見せる 売却 粋 滋賀 舞台 ゆとり 完売 アドレス モダン 橋 叶える 彩る 欠く 医 土地 進化 一括 追求 査定 全国 ライオンズ 四季 翠 光 今後 ローン 満たす 層 演出 ワン 電気 マルチ 公共 おしゃれ サポート センター 作 場所 あり 金融 医療 入居 づくり 少し 平均 種 徹底 心 事業 食 ならでは 特別 相談 対応 杜 見つかる 安全 守る エル 花 買う ショップ 評価 人 道路 せる 申込 間 いっぱい たっぷり 選ぶ マイ 販売 レ デザイン もちろん 入る 電柱 真正面 風格 南禅寺 うめく 最寄り 鹿ノ下通 学研都市線 新北野 布引 張 西渋川 鴨谷台 福知山 神足 済生会 深呼吸 モダニズム レジャースポット 境地 響く 悠久 一直線 帝塚山西 五山 安らぐ 下鴨東森ケ前 住之江公園 翠ケ丘 隣地 陵 長野東 平安 安らぎ 融和 山陽電気鉄道 深草キトロ 住吉公園 住吉東 大阪ドーム 御所 モノレール 河川 久度 深江南 北新地 南長尾 三反田 遮る 奉行前 宮 ニシ 悲田院 明石海峡大橋 苦楽 桂川 浜辺通 登記 唐橋 蒲生 竹見台 いずみ 新神戸 中核 千里丘下 松ケ崎 実物 冷泉 のびやか 複 雅 粋人 市役所 崎 都賀 北葛城 シミュレーター 山系 エコール 堀之上 大林 縦横無尽 千里山星が丘 天神橋 阪神国道 夷川 きわだつ 妥協 藤阪東 西梅田 ミナミ 上る 紡ぐ 連ねる 保温 キタ 古都 堀川 夕陽 寝屋川 情緒 片町線 ノンストップ 寛げる 嵯峨新宮 高め 寺戸 結実 六甲道 設える 息づく 住友商事 鴨川 ジェイアール西日本 玉造本 夕陽ケ丘 斜面 遺産 東心斎橋 上立売 尼崎 栄町通 別荘 東面 進取 内覧 星和 川原 手中 趣き 浜口西 京阪百貨店 くらせる サッシ 小児科 西向き 名鉄 紫野雲林院 のぞみ野 唐橋川久保 池島 山側 魚崎南 坪 臨む 阪 北側 もたせる 闊達 岡崎南御所 山鉾巡行 南端 糺 神楽 思想 北面 ぎんなん 百足屋 ドラム 信号 壮大 出口 堂ケ芝 下鴨神社 山陽本線 併せ持つ 京阪本通 江之子島 下る 庄内東 向日 浴槽 美学 直接アクセス 間口 謳う メゾネット 日当 壬生坊城 界隈 天使突抜 稜線 送り火 ディスポーザー 竹の台 軒 難波 ルーフ 南大阪線 愛する 語り継ぐ もてなす 南田辺 ブリッジ 祇園祭 万歳 携える 開口 なだらか ダイワハウス 県庁 山陰本線 掌中 寿 由緒 東中 古墳 津雲台 足代北 右京 千日前線 新幹線 蛭子 玉井 井吹台西 新千里南 中白山 西天満 手 スマート マーク 海 やすらぐ 麗しい 感性 乗り継ぎ 東大阪 喧騒 発想 辻 伸びやか 謳歌 和洋 斜め 築く やく パーティ 多面 降り注ぐ 神宮前 東住吉 美意識 ミセス 出逢う 心から 居 寄る 防犯 訪れる 成約 感度 公園前 ほど近い ストリート ギュッ 芯 マルイ トランス 奏でる 遅い 相応しい 有する リビング 側 清々しい ふれあう 注ぐ 総力 強力 出し ロード 池 自由自在 志向 グッド 極める 唯一 こなす 存分 壁 優雅 五感 大阪ガス コンパクト 外食 待つ 都会 精神 交流 供給 行ける 宅地 図書館 群 空港 ロボット 兼ね備える 彩 流れる 良い 棟 コーナー 適す 郡 港 余裕 気持ちいい 史上 風光 匠 スペース 主義 明媚 大宮 買い物 完結 旅館 ポート シャープ サイクル いっしょ 忠 ランク 映える 家具 同士 渡る ルート 堪能 形成 彩り チェック トップ つなぐ 旭 六甲 構築 爽やか 飲食 新千里東 原点 北口 満ちる 溶け込む 個性 魚 空気 集合 即日 軽減 含める 華やぐ 甲 震る 使いこなす 意匠 陽光 改札 住まう 落ち着き エン 静けさ 大空 我が家 区画 纏う 若干 建てる 作り 市営 伊藤 三井不動産 南面 そば 始発 生かす バルコニー 自転車 水辺 創出 交差 年収 前列 憩い 南西 ターミナル 面する スパン 見晴らす 防災 結集 面す ガラス 最前 誇り 時間 ため 使いこなせる 方面 集う オアシス スケール 広々 高齢 電化 一体 いま 受け継ぐ 湊 ブリ くつろぐ 店 世代 リア 外観 距離 著しい 注目 スピーディ アパート 開業 奥 注文 家電 先着 口 明治 馬場 支える 乗り換え 両方 方式 体制 お洒落 標準 野村 優しい 組 カフェ 将来 シーン 削減 講座 ふさわしい 風景 生きる フラワー タウン 展望 搭載 山田 クリニック 手がける 設置 席 拠点 生まれ変わる 活かす 配慮 借りる 倉庫 アプローチ 進行 ダイレクト 優良 もと 発展 伝統 存在 フロント プライベート 愛 記念 雰囲気 最も 歩く 呼ぶ 長期 体感 カンパニー 整理 由来 共同 大 建築 どこ 重視 リンク 少ない 甲信越 忘れる 社 深い め 白 認定 インタビュー 建物 すべて 使う 順 特集 不要 時 一部 おる リクルート 戻る 働く 連続 自由 日々 売る 四国 置く 北陸 役立つ わかる 夜 メイン 取得 幅広い 長い 心地 月額 東海 コンビニ 価値 突破 ライブラリー 記載 それぞれ 印象 集まる 進む さまざま 完成 流れ マガジン 聞く 九州 はじまる 東北 独自 決定 贅沢 多数 変わる 園 サイド 沖縄 予め ここ シリーズ ご覧 明るい 加える 作る ヶ月 行く 中国 北海道 コーディネート 和 料金 基本 更新 こだわる 上 高津 部 土 者 実際 その他 メール 品質 グループ 向け 開催 ガイド 楽しい 風 合う そう 以上 探す プライバシー 方 ない 年 閉じる 世界 実感 料 了承 常盤 ステージ 店舗 先頭 ヒル 目指す 最新 ら 現在 月々 くれる 返済 多く 水 総合 以内 希望 地下 こだわり カラー 番 森 会 部屋 品 みる プレミアム 新着 メニュー いただける 営業 自分 関東 初めて 最終 プロ もの 使用 あなた 今 美容 届け やすい 合わせる ブランド よう うち スタイル の られる 予約 購入 女性 お知らせ すぐ マップ ポリシー 期間 こと 商 サービス 規約 会員 くださる 利用 ページ 情報 いる 登録 円 会社 月 サイト なる 中 する ある 問い合わせ できる 日
1385	経験 歓迎 年収 県 不問 上場 職 人材 学歴 業種 仕事 歳 営業 勤務 新卒 求める 関連 検討 正社員 週休 管理 転職 店長 転勤 保存 終了 更新 戻る 地 金融 業務 専門 システム 急募 者 マネージャー 提案 機器 業界 リスト 店 職種 東証 予定 詳細 工事 制 完全 あり モデル 企画 株式会社 追加 広告 例 他 開発 コンサルタント 言語 店舗 内容 系 土木 選択 先頭 条件 本社 任せる ターン 割 担当 反映 候補 大阪 年 丸亀 アミューズメント 愛知 建設 求人 特徴 物流 設備 通信 フード 電通 麺 業態 外資 広島 ビジネス 兵庫 住宅 インターネット ネットワーク 入社 建築 設計 その他 電気 運営 福岡 エンジニア 以上 飲食 自動車 首都 秋田 京都 海外 制度 メーカー 事務 住友不動産 項目 農林 半導体 鹿児島 マネジメント 和歌山 東京 北海道 メンテナンス 製 接客 商社 銀行 社員 小売 投資 流通 仙台 長野 リーダー 水産 レジャー 用品 コンサルティング 千葉 埼玉 掲載 販売 経営 パッケージ オフィス 東新橋 浜松町 大門 揚げ 釜 新潟 医療 スキル 派遣 電子 資格 士 ノウハウ 府 見る 適性 計画 ドール 直営 本文 讃岐 ぐる 施工 保険 コーディネーター ゲーム エリア 自社 楽天 売上 環境 不動産 神奈川 エネルギー 支社 プライム 出店 初年度 普 トリ ウド ベンチャー スタッフ 滋賀 圏 北関東 金属 官公庁 信託 貴金属 島根 岩手 徳島 山形 ドラッグストア 愛媛 方 総合 生産 奈良 当社 群馬 岡山 比率 福井 宮崎 保守 鳥取 マネジャー 実績 静岡 岐阜 香川 長崎 青森 クラ 人柄 オーナー 山口 移転 自衛隊 労務 消防 富山 一部 製品 サービス 三重 うどん 意欲 バイザー 山梨 経歴 服装 積算 通訳 デジタル 引渡し アプリケーション 高知 携わる 福祉 法人 交通 等 いずれ インテリア ドライバー 運用 熊本 佐賀 件 現在 全国 機械 化学 大分 繊維 石川 機関 職員 ワーク 形態 用いる フレーム 最寄駅 スタイリスト ホテル 技術 マーケティング 宮城 スポーツ 委託 雇用 研究 中国 支援 一貫 ドレス 汐留 町村 新橋 市区 経理 独立 都 先 契約 構築 ブライダル 名古屋 人事 領域 ビル 応じる 福島 芸能 含める 興味 カウンセリング 研修 社会 閲覧 活躍 社内 保育 新着 企業 採用 駅 キャリア 分譲 製造 食品 免 学校 知識 建 旅行 通勤 倉庫 登用 誇る 心配 リフォーム 診断 履歴 栃木 応募 重視 募集 甲信越 メディア 新築 使う ない お客様 大卒 盛岡 ヒアリング 保線 ＥＣ 駅舎 サンドラッグ 転居 東日本旅客鉄道 工法 着工 難問 めし 衣裳 道玄坂 トンネル 松屋フーズ 農協 高架 橋りょう ＪＲ東日本 自由 連続 北陸 構造 物 四国 用 持つ 希望 茨城 映像 積極 東海 取得 東北 教育 放送 規模 九州 線路 課長 末日 指示 チーフ サポーター モデルハウス 育成 立 最先端 上げ 監理 ヶ所 中心 スーパー 沖縄 一般 説明 チェック 関西 セキュリティ 介護 窯業 鉱業 海運 キャピタル 障る 金庫 バックアップ 産休 セラミック 待ち 働ける シンクタンク 配属 膨大 有無 育休 水戸 分煙 牛 プログラミング 農業 政府 建材 高卒 理容 仮想 調剤 宝飾 有線 ホームセンター チェーンストア 要件 課題 アーキテクチャ フレックス 無線 信用組合 中途 空輸 マイカー 人月 陸運 そっくり セメント 協同 鉄鋼 パルプ 定義 最近 基本 玩具 制御 リース サーバ 抱える 情報処理 薬局 顧問 プラント テクノロジー 共済 待遇 購買 受託 卒業 立案 文具 ファストフード 人々 冠婚葬祭 ストレージ 洋食 東日本 ディスプレイ 精密 信販 音響 内装 電機 エンジニアリング 生活協同組合 本部 退社 信用金庫 簡易 非鉄 品質 年齢 素材 アジア 直営店 みなさん ピックアップ 支給 公的 家賃 バンク 運輸 定時 スコア 高等 組合 スペシャリスト ブランク 万全 挙式 和食 警察 考慮 役に立つ 禁煙 印刷 タクシー 出張 レンタル 参照 給与 加盟 コンビニエンスストア トップクラス 生損保 損害 ソフトウェア 問う 込 探る 向上 あなた デザイン しっかり 化 サポート アド 石油 出版 回路 測量 治験 公務員 用地 税理士 先輩 職務 データベース 在籍 那覇 運命 貿易 ガス テクニカル マスコミ コンピューター 工程 プログラマー アパレル リサイクル 仕る 警備 リアルタイム メガネ 保全 優遇 輸送 インフラ 観光 育児 系統 保有 紙 警察官 語 プロセス 学術 服飾 スイッチ 書籍 行動 サーバー アート 接する 財務 伴う ファッション 内 重 弁護士 パート 外部 クリエイティブ 解析 提携 資金 新聞 薬剤師 特殊 代理 特許 大手 表参道 メンバー スケジュール ホール プランナー セールス 工 残業 衛生 栄養士 思い ユーザー 松屋 技能 インストラクター 貢献 宣伝 人数 総務 社宅 段階 答える 供給 公益 外食 毎週 スクール 証券 音楽 講師 戸 電力 港 免許 労働 感動 渋谷 ゴム 会計 医薬品 カメラ 電 団体 旅館 ディレクター おし 看護 要望 コール 教師 補助 原則 プロデューサー 最大限 学ぶ 調理 生命 休暇 英語 信頼 最適 行政 全額 本格 ガラス 月末 グループ 検索 人 区 女性 医薬 必要 進める 戸数 相談 師 品 日本 自分 活用 横浜 クレジット 家電 百貨店 都道府県 体制 員 年間 組 休日 費 文教 運転 文化 モバイル 調査 拠点 所在地 処理 優良 発展 橋 基礎 活かす 一括 必須 編集 解決 神戸 テスト 整備 一切 住まい 市場 社 事務所 業 空間 公共 可能 美容 分かる 可 マンション 普段 旬 期待 着 各種 ネット 級 雑貨 控える プログラム ぜひ エステ クリア 小物 食 職場 金 事業 考える 多数 モール ごと 独自 アルバイト 地域 配送 ご覧 シーサイド 最大 型 実現 コーディネート 様々 産業 新横浜 高崎 簡単 ため 普通 消費 イベント 含む 評価 合う 好き 限定 後 化粧 結果 鉄道 葉 商品 点 代 八王子 手 目指す 名 様 性 品川 行う 指定 いく 大宮 以内 バス 関東 所 質問 池袋 高い 注目 注文 街 ショッピング もっと いただく すべて 的 合わせる 届け 紹介 特集 くださる 表示 ハウス センター タワー プロジェクト 次 すぐ 前 受付 さん せる 時間 向け 時 今 ログイン 個人 会員 取引 無料 利用 ページ 情報 登録 いる 円 会社 月 サイト 中 する ある できる 日
477	コンテンツ 得 ログイン
479	便 スカート 可 丈 消費 メール ひざ カラ 定価 税込 花 糸入り 霜降り 巻く ギャザー 単色 柄 ラメ ボンディング ところ ミドル 価格 新作 フレア 後ろ ショート 衝撃 替える カテゴリ 切り替える 並び 順 セール ボトム 限定 入荷 美 栄子 Ｑ＆Ａ 時 紗 全品 一覧 着る 買い上げ よろしい レビュー 安い おすすめ サンダル 取扱い ログアウト 停止 申込 送料 用 支払い 税 ホーム カート もっと 新着 高い みる ランキング 見る マイ 特集 アイテム ガイド 基づく 検索 版 概要 法 方法 商品 以上 商 特定 取引 ログイン 個人 表示 利用 ページ 情報 円 会社 する 日
